{
  "schema_version": "1.0",
  "lesson_id": "e0-s0-walking-skeleton",
  "manifest_blake3": "aaaaaaaaaaaaaaaaaaaaaaaaaaaaaaaaaaaaaaaaaaaaaaaaaaaaaaaaaaaaaaaa",
  "checklist_version": "1.0",
  "reviewer": "Ross Todd",
  "reviewer_role": "project owner",
  "playback_environment": "monitors, treated room",
  "disposition": "accepted"
}
